{
  "$schema": "../schemas/fork-manifest.schema.json",
  "schema_version": "1.0.0",
  "manifest_id": "ivekit-forks-v1",
  "revision": 52,
  "status": "proposed",
  "generated_at": "2026-07-28T10:20:49+08:00",
  "profile_ids": [
    "mix-100k-v1"
  ],
  "notes": [
    "This manifest records design and repository state; it does not assert that MIX-100K has passed.",
    "A release tag without a resolved 40-character commit or an image tag without a digest is not a complete production identity.",
    "The exact ivekit.16 amd64 Linux image was built on the controlled four-vCPU server as local image sha256:9a9e94764b710d0520a570db4ca444418239592e8e1181bd783c4589f14045ad. At 1,400 CPS it completed 42,000 of 42,000 calls with zero failures, zero remaining calls, zero retransmissions and exact Router/CDR parity. The same image completed 42,000 of 42,000 calls while the CDR sink was unreachable; Router parity remained exact, CDR delivery correctly remained zero, and five-second warning throttling reduced RustPBX output from the previous 42,008-line failure amplification to seven lines.",
    "A controlled ivekit.15 boundary run at 1,500 CPS did not pass the strict gate: 20 calls remained active and Router/CDR counts exceeded the expected total by four. The evidence therefore establishes a 1,400-CPS signaling baseline on this shared four-vCPU host, not production capacity, RTP capacity, Cell-10K or MIX-100K completion.",
    "The exact ivekit.18 amd64 Linux image sha256:d36c5b94a1f63dfc5c1536f7bd00d6a23e5a3eecee26e6dfc7ebf3dd95c16b22 passed separate direct-RustPBX and SIPp-through-Kamailio 60-second 1,000-CPS gates: both completed 60,000 of 60,000 calls with exact Router/CDR parity and zero failures, remaining calls, retransmissions or queue drops; the full edge path also had exact 60,000 Kamailio INVITEs and route P95/P99 of 8/19 ms. This accepts the HTTP-capacity regression gate but is not a new maximum-CPS, RTP or production-capacity claim.",
    "The exact ivekit.19 amd64 Linux candidate image sha256:da8407a298fe782d082c1d1f0f63609e1958f6f3f04b98d70324b7ff68a288cb was built with the pinned RustPBX, rsipstack and rustrtc sources plus the locked dependency graph. Its configured RTP/RTCP socket buffers are visible at runtime. Strict 10-call packet-sequence evidence and controlled 600/800-call throughput evidence pass on the shared four-vCPU host; the 150-call strict run is generator-invalid and the 900-call throughput runs are mixed or inconclusive, so independent-generator and Cell-10K capacity remain release gates.",
    "Business licensing decisions are outside this architecture record; engineering traceability and source identity remain release requirements.",
    "RTPengine Goal 2 userspace implementation finalized with exact-artifact functional evidence; benchmark and capacity claim remain not_run/none."
  ],
  "components": [
    {
      "component_id": "rustpbx",
      "name": "RustPBX",
      "role": "SIP B2BUA, IVR, RTP proxy, recording fork, and voice interaction owner",
      "lifecycle": "active_engineering",
      "integration_mode": "patch_queue",
      "source_modification_allowed": true,
      "upstream": {
        "repository": "https://github.com/restsend/rustpbx",
        "version": "0.4.11",
        "pin_kind": "exact_commit",
        "commit": "6c49ee76baa54fdbf8f98020cc9bee158c7c15de",
        "source_identity_complete": true
      },
      "build": {
        "reproducible": true,
        "lockfile_enforced": true,
        "script": "infra/ivekit/rustpbx/build.sh",
        "builder_image": "rust:1.94-bookworm@sha256:6ae102bdbf528294bc79ad6e1fae682f6f7c2a6e6621506ba959f9685b308a55",
        "features": [
          "cross"
        ],
        "output_image": "ivekit/rustpbx:0.4.11-ivekit.33-6c49ee76"
      },
      "runtime_artifact": {
        "reference": "ivekit/rustpbx:0.4.11-ivekit.33-6c49ee76",
        "kind": "custom_candidate",
        "contains_declared_modifications": true
      },
      "patches": [
        {
          "path": "infra/ivekit/rustpbx/patches/rustpbx-ivekit-ami-dialogs.patch",
          "sha256": "ef6f60678eb5d126196b92c3e434597ce6286dd219f83951d387074024f0cf56",
          "applies_to": "rustpbx@6c49ee76baa54fdbf8f98020cc9bee158c7c15de",
          "purpose": "Expose bounded dialog observation needed by iveKit voice control and audit."
        },
        {
          "path": "infra/ivekit/rustpbx/patches/rustpbx-ivekit-rwi-originate-hangup.patch",
          "sha256": "901ac9c66747098d06381c9aac5086f13f8f4ec3cdee6127cfcde742069c8f25",
          "applies_to": "rustpbx@6c49ee76baa54fdbf8f98020cc9bee158c7c15de",
          "purpose": "Add controlled originate and hangup commands used by the iveKit voice gateway."
        },
        {
          "path": "infra/ivekit/rustpbx/patches/rustpbx-local-rsipstack.patch",
          "sha256": "feda9f849a740dc7ac9e690a81e8b21f3939b8f363483590b4c2869420bdd170",
          "applies_to": "rustpbx@6c49ee76baa54fdbf8f98020cc9bee158c7c15de",
          "purpose": "Build against the separately pinned and patched rsipstack source tree."
        },
        {
          "path": "infra/ivekit/rustpbx/patches/rustpbx-local-rustrtc.patch",
          "sha256": "b3b0ec03794eec5272d4a5c904566a4558007e496d7f7e56ba332f19bf2664d3",
          "applies_to": "rustpbx@6c49ee76baa54fdbf8f98020cc9bee158c7c15de after rustpbx-local-rsipstack.patch",
          "purpose": "Build against the separately pinned and patched rustrtc source tree."
        },
        {
          "path": "infra/ivekit/rustpbx/patches/rustpbx-ivekit-route-snapshot.patch",
          "sha256": "affa18e5ed9b25ba102213cd7f015ef4c0f4a72b913dc48a87ca02e707a1a5b5",
          "applies_to": "rustpbx@6c49ee76baa54fdbf8f98020cc9bee158c7c15de",
          "purpose": "Replace per-INVITE control-plane routing calls with signed, short-lived, tenant-fenced HMAC route snapshots and an in-memory lookup, including standards-compliant display-name SIP To parsing."
        },
        {
          "path": "infra/ivekit/rustpbx/patches/rustpbx-ivekit-inbound-admission.patch",
          "sha256": "629c9488981c8c2f47764c9874b2794ca7109ce74f99852657675c03959b7b1d",
          "applies_to": "rustpbx@6c49ee76baa54fdbf8f98020cc9bee158c7c15de after rustpbx-ivekit-route-snapshot.patch",
          "purpose": "Require exact Cell and RustPBX node admission before an inbound INVITE may use the local signed route snapshot."
        },
        {
          "path": "infra/ivekit/rustpbx/patches/rustpbx-ivekit-owner-epoch.patch",
          "sha256": "2a1bc920a9ec092710cea0fc36d0fe7c08bfb6d0ce57d3acb26243e46ab8304d",
          "applies_to": "rustpbx@6c49ee76baa54fdbf8f98020cc9bee158c7c15de after rustpbx-ivekit-inbound-admission.patch",
          "purpose": "Embed the Rust component guard, accept standards-compliant SIP Call-ID words while keeping node IDs strict, authorize inbound ownership through the local component-node agent, and fence every tracked RWI mutation by the exact owner epoch."
        },
        {
          "path": "infra/ivekit/rustpbx/patches/rustpbx-ivekit-recording-spool.patch",
          "sha256": "4ee41d5762b4295f67c4cfb985b233485e3f34ce4f0468fe5532d3039ea2fd76",
          "applies_to": "rustpbx@6c49ee76baa54fdbf8f98020cc9bee158c7c15de after rustpbx-ivekit-owner-epoch.patch",
          "purpose": "Rotate bounded local encoded recording segments, publish durable owner-fenced manifests, and keep legacy HTTP/S3 upload outside iveKit spool mode."
        },
        {
          "path": "infra/ivekit/rustpbx/patches/rustpbx-ivekit-sip-capacity.patch",
          "sha256": "6d6319d806668e130b7b063f8306cb1a33a6e21089342c83e4971713102e6c6d",
          "applies_to": "rustpbx@6c49ee76baa54fdbf8f98020cc9bee158c7c15de after rustpbx-local-rsipstack.patch",
          "purpose": "Bind profile-tunable rsipstack transaction, queue, cache and transport limits into RustPBX and export bounded-cardinality overload telemetry."
        },
        {
          "path": "infra/ivekit/rustpbx/patches/rustpbx-ivekit-media-hot-path.patch",
          "sha256": "9a7508bcf1a5b4af0904e47cd78e108e4e23c0e66d66606462ee096f9fc33e5e",
          "applies_to": "rustpbx@6c49ee76baa54fdbf8f98020cc9bee158c7c15de after rustpbx-ivekit-sip-capacity.patch",
          "purpose": "Move recording codec and disk work out of RTP forwarding loops through profile-tunable bounded capture queues, bounded pre-finalization draining, one-shot disk-failure circuit breaking, and explicit low-cardinality drop telemetry."
        },
        {
          "path": "infra/ivekit/rustpbx/patches/rustpbx-ivekit-session-cleanup-isolation.patch",
          "sha256": "371e4e14e69b919ad5374d7fad68e7e4dc3fb5635c7d1639f0ee872d72026d27",
          "applies_to": "rustpbx@6c49ee76baa54fdbf8f98020cc9bee158c7c15de after rustpbx-ivekit-media-hot-path.patch",
          "purpose": "Remove session teardown awaits from the media command loop, submit recording finalization first, and bound playback, MCU, and bridge cleanup with explicit concurrency, timeout, and low-cardinality outcome telemetry."
        },
        {
          "path": "infra/ivekit/rustpbx/patches/rustpbx-ivekit-webphone-registry.patch",
          "sha256": "dbc856affd3052832c189c2f70f036accc0bf2ea8cd9b73a3ed97afd1f0b7e68",
          "applies_to": "rustpbx@6c49ee76baa54fdbf8f98020cc9bee158c7c15de after rustpbx-ivekit-session-cleanup-isolation.patch",
          "purpose": "Replace the serialized linear WebPhone pre-authentication registry with O(1) keyed lookup and generation-fenced connection-lifetime cleanup."
        },
        {
          "path": "infra/ivekit/rustpbx/patches/rustpbx-ivekit-callrecord-capacity.patch",
          "sha256": "2152184c6def8c3b56125a428faa23e6a68b1a7511bf363a79e49cfcf267e8b9",
          "applies_to": "rustpbx@6c49ee76baa54fdbf8f98020cc9bee158c7c15de after rustpbx-ivekit-webphone-registry.patch",